1887,simple,,,"Asrock Z790 STEEL LEGEND WIFI, Intel Z790, 1700, ATX, 4 DDR5, HDMI, DP, eDP, Wi-Fi 6E, 2.5G LAN, PCIe5, RGB, 5x M.2",1,0,visible,,"<p>Z790 Steel Legend WiFi supports 13th Gen &amp; 12th Gen Intel® Core™ Processors with a 16+1+1 Phase Power Design. It features 4 x DDR5 DIMMs, PCIe 5.0, HDMI, DisplayPort, and Wi-Fi 6E connectivity.</p>",,,taxable,,1,,,0,0,,,,,1,,,"249,99","PC Components > Motherboard > Asrock",,,https://webmall-1.informatik.uni-mannheim.de/wp-content/uploads/2025/05/2846.jpg,,,,,,,,,0,,xcase.co.uk_721,2846,1,uag-css-1887.css,
1888,simple,,,"Asus ROG STRIX RTX4080 SUPER, PCIe4, 16GB DDR6X, 2 HDMI, 3 DP, 2580MHz Clock, RGB Lighting",1,0,visible,,"<p>ROG Strix GeForce RTX 4080 SUPER 16GB GDDR6X with DLSS 3 and chart-topping thermal performance. Powered by NVIDIA DLSS3, ultra-efficient Ada Lovelace architecture, and full ray tracing capabilities.</p>",,,taxable,,1,,,0,0,,,,,1,,,"1399,99","PC Components > GPU > Asus",,,https://webmall-1.informatik.uni-mannheim.de/wp-content/uploads/2025/05/2848.png,,,,,,,,,0,,xcase.co.uk_150,2848,1,uag-css-1888.css,2
1889,simple,,,"Philips 3-pin Wall Plug USB-C &amp; USB-A Charger, 30W, Fast Charge, Power Delivery",1,0,visible,,"<p>Wall charger with Type C and USB-A ports. Ultra-fast wall charger. Charge your latest devices from USB-C port with PD support to optimise the charging power and minimise the charging time. Also use the USB-A port to charge your other devices simultaneously. Smart protection against overheating, overvoltage and overcurrent. Fast charging - charge your mobile phone from 0 to 50% in 30 minutes.</p>",,,taxable,,1,,,0,0,,,,,1,,,"29,99",Philips,,,https://webmall-1.informatik.uni-mannheim.de/wp-content/uploads/2025/05/2850.png,,,,,,,,,0,,xcase.co.uk_387,2850,1,,
1890,simple,,,"Asrock H510M-H2/M.2 SE, Intel H510, 1200, Micro ATX, 2 DDR4, 2 HDMI, 1x M.2",1,0,visible,,"<p>Asrock H510M-H2/M.2 SE supports 10th and 11th Gen Intel® Core™ Processors (LGA1200) with a 4 Power Phase Design, DDR4 3200 MHz support, and dual HDMI outputs for enhanced multi-monitor compatibility.</p>",,,taxable,,1,,,0,0,,,,,1,,,"89,99","PC Components > Motherboard > Asrock",,,https://webmall-1.informatik.uni-mannheim.de/wp-content/uploads/2025/05/2852.jpg,,,,,,,,,0,,xcase.co.uk_386,2852,1,uag-css-1890.css,
1891,simple,,,"Asus ROG STRIX B550-F GAMING, AMD B550, AM4, ATX, 4 DDR4, HDMI, DP, XFire, 2.5GB LAN, RGB Lighting, M.2",1,0,visible,,"<p>AMD B550 ATX gaming motherboard with PCIe 4.0, dual M.2 with heatsinks, Intel 2.5Gb Ethernet, and Aura Sync RGB lighting. Designed for 3rd Gen AMD Ryzen processors, it offers robust power delivery and comprehensive cooling for high-performance gaming.</p>",,,taxable,,1,,,0,0,,,,,1,,,"189,99","PC Components > Motherboard > Asus",,,https://webmall-1.informatik.uni-mannheim.de/wp-content/uploads/2025/05/2854-scaled.jpg,,,,,,,,,0,,xcase.co.uk_1108,2854,1,uag-css-1891.css,1
1892,simple,,,"Corsair Vengeance RGB 32GB Kit (2 x 16GB), DDR5, 6200MHz (PC5-49600)), CL36, 1.4V, XMP 3.0, PMIC, DIMM Memory",1,0,visible,,"<p>CORSAIR VENGEANCE RGB DDR5 memory delivers high performance with dynamic, individually addressable ten-zone RGB lighting. Optimized for Intel motherboards, it features tightly screened high-frequency memory chips for faster processing and onboard voltage regulation for easy overclocking. Customize RGB lighting and performance profiles with CORSAIR iCUE software.</p>",,,taxable,,1,,,0,0,,,,,1,,,"159,99","PC Components > Memory > Corsair",,,https://webmall-1.informatik.uni-mannheim.de/wp-content/uploads/2025/05/2859.webp,,,,,,,,,0,,xcase.co.uk_774,2859,1,uag-css-1892.css,1
1893,simple,,,"Corsair Vengeance RGB 32GB Kit (2 x 16GB), DDR5, 5600MHz (PC5-44800), CL40, 1.25V, XMP 3.0, PMIC, DIMM Memory, Black",1,0,visible,,"<p>CORSAIR VENGEANCE RGB DDR5 memory delivers high performance with dynamic, individually addressable ten-zone RGB lighting. Optimized for Intel motherboards, it features tightly screened high-frequency memory chips for faster processing and onboard voltage regulation for stable overclocking. Customize your RGB lighting and performance profiles with CORSAIR iCUE software.</p>",,,taxable,,1,,,0,0,,,,,1,,,"159,99","PC Components > Memory > Corsair",,,https://webmall-1.informatik.uni-mannheim.de/wp-content/uploads/2025/05/2860.jpg,,,,,,,,,0,,xcase.co.uk_965,2860,1,uag-css-1893.css,1
1894,simple,,,"GameMax Meshbox Full WhiteGaming Case, ATX, Mesh Panels, Modular Design, Vertical Airflow Design, No Fans inc., USB-C",1,0,visible,,"<p>Meshbox Full White Gaming Cube ATX Modular Gaming PC Case with Dual Mesh Side Panels and USB Type-C. The GameMax Meshbox features a professional design with excellent airflow, modular design, and optimized cable management. It supports multiple storage options and includes dust filters for easy maintenance.</p>",,,taxable,,1,,,0,0,,,,,1,,,"69,99","PC Components > Cases > GameMax",,,https://webmall-1.informatik.uni-mannheim.de/wp-content/uploads/2025/05/2875.jpg,,,,,,,,,0,,xcase.co.uk_1,2875,1,uag-css-1894.css,
1895,simple,,,"Sandberg BossBlaster USB Gaming Headset, Padded Headband, LED Lights, 5 Year Warranty",1,0,visible,,"<p>The Sandberg BossBlaster USB Headset is a stylish gaming headset that provides impressive stereo sound for a sublime gaming experience. A sensitive microphone ensures clear communication, while the adjustable headband with soft padding allows for comfortable wear during long gaming sessions. The earcups feature built-in LED lights.</p>",,,taxable,,1,,,0,0,,,,,1,,,"49,99","Peripherals > Headset > Sandberg",,,https://webmall-1.informatik.uni-mannheim.de/wp-content/uploads/2025/05/2881.jpg,,,,,,,,,0,,xcase.co.uk_21,2881,1,,
1896,simple,,,"Sandberg USB Office Headset with Boom Mic, 30mm Drivers, In-Line Controls, 5 Year Warranty",1,0,visible,,"<p>The Sandberg USB Office Headset connects to a USB port on your computer. The clear sound reproduction makes it perfect for Internet telephony. It features an elegant inline volume control for quick adjustments.</p>",,,taxable,,1,,,0,0,,,,,1,,,"39,99","Peripherals > Headset > Sandberg",,,https://webmall-1.informatik.uni-mannheim.de/wp-content/uploads/2025/05/2882.jpg,,,,,,,,,0,,xcase.co.uk_1004,2882,1,,
1897,simple,,,"Asus ROG DELTA S Core Gaming Headset, Hi-Res, 3.5mm Jack, Boom Mic, Lightweight, PS5 Compatible",1,0,visible,,"<p>Lightweight 3.5 mm gaming headset with 50 mm ASUS Essence drivers, virtual 7.1 surround sound, and a Discord-certified boom microphone for clear in-game communication. Compatible with PCs, PlayStation 5, Nintendo Switch, and Xbox.</p>",,,taxable,,1,,,0,0,,,,,1,,,"89,99","Peripherals > Headset > Asus",,,https://webmall-1.informatik.uni-mannheim.de/wp-content/uploads/2025/05/2893.png,,,,,,,,,0,,xcase.co.uk_436,2893,1,uag-css-1897.css,
1898,simple,,,"Palit RTX4070 Ti SUPER GamingPro White OC, 16GB DDR6X, HDMI, 3 DP, 2655MHz Clock, RGB Lighting, Overclocked",1,0,visible,,"<p>Brighten up your world and triumph in style with the Palit GeForce RTX 4070 Ti SUPER GamingPro White OC. Refreshed with a white color scheme, it embodies refined purity and powerful aesthetics. Equipped with a solid thermal module, the GamingPro White is capable of tackling any gaming and creative task at hand. Powered by NVIDIA DLSS 3, ultra-efficient Ada Lovelace architecture, and full ray tracing.</p>",,,taxable,,1,,,0,0,,,,,1,,,"999,99","PC Components > GPU > Palit",,,https://webmall-1.informatik.uni-mannheim.de/wp-content/uploads/2025/05/2897.jpg,,,,,,,,,0,,xcase.co.uk_1062,2897,1,uag-css-1898.css,1
1899,simple,,,"Kingston Fury Beast 16GB, DDR5, 5600MHz (PC5-44800), CL40, 1.25V, ECC, XMP 3.0, PMIC, DIMM Memory",1,0,visible,,"<p>Kingston FURY Beast DDR5 Memory brings the latest cutting-edge technology for next-gen gaming platforms. It features improved stability for overclocking, increased efficiency, and is Intel® XMP 3.0-Ready and Certified. With a low-profile heat spreader design, this memory is perfect for extreme gaming settings and demanding applications.</p>",,,taxable,,1,,,0,0,,,,,1,,,"75,99","PC Components > Memory > Kingston",,,https://webmall-1.informatik.uni-mannheim.de/wp-content/uploads/2025/05/2900.jpg,,,,,,,,,0,,xcase.co.uk_501,2900,1,uag-css-1899.css,14
1900,simple,,,"Lenovo V15 G4 IRU Laptop, 15.6"" FHD, i5-13420H, 16GB, 512GB SSD, No Optical, USB-C, Windows 11 Home",1,0,visible,,"<p>Tired of entry-level laptops that lack the tools you need to run a business? The Lenovo V15 Gen 4 laptop is both feature packed and value priced. You'll enjoy powerful Intel processing, battery-efficient Intel integrated graphics, and a conveniently sized, 15.6"" display that gives a great workspace. There's plenty of memory to accelerate tasks and abundant storage for your files.</p>",,,taxable,,1,,,0,0,,,,,1,,,"749,99","PC Components > Laptop > Lenovo",,,https://webmall-1.informatik.uni-mannheim.de/wp-content/uploads/2025/05/2903.jpg,,,,,,,,,0,,xcase.co.uk_39,2903,1,uag-css-1900.css,
1901,simple,,,"Asus DUAL RTX4070 SUPER EVO OC, PCIe4, 12GB DDR6X, HDMI, 3 DP, 2550MHz Clock, Overclocked, White",1,0,visible,,"<p>ASUS Dual GeForce RTX 4070 SUPER EVO OC Edition 12GB GDDR6X with two powerful Axial-tech fans and a 2.5-slot design for broad compatibility. Powered by NVIDIA DLSS3 and ultra-efficient Ada Lovelace architecture, it features advanced cooling solutions and 0dB technology for silent operation.</p>",,,taxable,,1,,,0,0,,,,,1,,,"599,99","PC Components > GPU > Asus",,,https://webmall-1.informatik.uni-mannheim.de/wp-content/uploads/2025/05/2906.webp,,,,,,,,,0,,xcase.co.uk_322,2906,1,uag-css-1901.css,15
1902,simple,,,"Corsair Vengeance 64GB Kit (2 x 32GB), DDR5, 5200MHz (PC5-41600), CL40, 1.25V, XMP 3.0, PMIC, DIMM Memory",1,0,visible,,"<p>CORSAIR VENGEANCE DDR5, optimized for Intel® motherboards, delivers higher frequencies and greater capacities of DDR5 technology in a high-quality, compact module. With onboard voltage regulation and custom Intel® XMP 3.0 profiles, it ensures your high-end CPU gets data quickly, making it ideal for gaming, content creation, and multitasking.</p>",,,taxable,,1,,,0,0,,,,,1,,,"299,99","PC Components > Memory > Corsair",,,https://webmall-1.informatik.uni-mannheim.de/wp-content/uploads/2025/05/2911.jpg,,,,,,,,,0,,xcase.co.uk_936,2911,1,uag-css-1902.css,
1903,simple,,,"Samsung 1TB 870 EVO SSD, 2.5"", SATA3, V-NAND, R/W, 560/530 MB/s, 98K/88K IOPS, 7mm",1,0,visible,,"<p>The world's favourite SSD. The latest model of the world's best-selling SSD series has finally arrived. The 870 EVO inherits the legacy of Samsung's pioneering SSD technology, boasting upgraded performance, reliability and compatibility to suit the needs of anyone from content creators and IT professionals to everyday users. The 870 EVO achieves the maximum SATA interface limit of 560/530 MB/s sequential speeds. Providing up to 600 TBW under a 5-year limited warranty, the 870 EVO meets the industry's leading standards of reliability. Upgrading to the 870 EVO is made easy for anyone with a desktop PC or laptop that supports a standard 2.5-inch SATA form factor.</p>",,,taxable,,1,,,0,0,,,,,1,,,"89,99","Storage > SSD > Samsung",,,https://webmall-1.informatik.uni-mannheim.de/wp-content/uploads/2025/05/2930.png,,,,,,,,,0,,xcase.co.uk_12,2930,1,uag-css-1903.css,2
1904,simple,,,"Antec FLUX Gaming Case w/ Glass Side, E-ATX, Multi Vent Design, Mesh/Wood Front, 5 PWM Fans, ARGB PWM Fan Hub, USB-C, BTF Compatible, Black",1,0,visible,,"<p>Antec FLUX Gaming Case features a multi-vent design for excellent airflow, includes 5 high-performance PWM fans, and supports vertical GPU mounting. Crafted with a combination of metal mesh and walnut wood for a premium look.</p>",,,taxable,,1,,,0,0,,,,,1,,,"129,99","PC Components > Cases > Antec",,,https://webmall-1.informatik.uni-mannheim.de/wp-content/uploads/2025/05/2932.webp,,,,,,,,,0,,xcase.co.uk_725,2932,1,uag-css-1904.css,
1905,simple,,,"Antec FLUX Gaming Case w/ Glass Side, E-ATX, Multi Vent Design, Mesh/Wood Front, 5 PWM Fans, ARGB PWM Fan Hub, USB-C, BTF Compatible, White",1,0,visible,,"<p>Antec FLUX Gaming Case features a multi-vent design for excellent airflow, includes 5 high-performance PWM fans, and supports vertical GPU mounting. Crafted with a combination of metal mesh and wood for a premium look.</p>",,,taxable,,1,,,0,0,,,,,1,,,"129,99","PC Components > Cases > Antec",,,https://webmall-1.informatik.uni-mannheim.de/wp-content/uploads/2025/05/2933.webp,,,,,,,,,0,,xcase.co.uk_914,2933,1,uag-css-1905.css,
1906,simple,,,"Kingston Fury Beast 32GB, DDR5, 5600MHz (PC5-44800), CL40, 1.25V, ECC, XMP 3.0, PMIC, DIMM Memory",1,0,visible,,"<p>Kingston FURY Beast DDR5 memory brings the latest cutting-edge technology for next-gen gaming platforms. It features improved stability for overclocking, increased efficiency, and is Intel® XMP 3.0-Ready and Certified. With a low-profile heat spreader design, it enhances performance for gaming and demanding applications.</p>",,,taxable,,1,,,0,0,,,,,1,,,"129,99","PC Components > Memory > Kingston",,,https://webmall-1.informatik.uni-mannheim.de/wp-content/uploads/2025/05/2936.jpg,,,,,,,,,0,,xcase.co.uk_168,2936,1,uag-css-1906.css,
1907,simple,,,"Microsoft Surface Laptop 4, 13.5"" Touchscreen, i5-1145G7, 16GB, 512GB SSD, Up to 17 Hours Run Time, USB-C, Windows 10 Pro, Platinum",1,0,visible,,"<p>Vibrant Touchscreen with a hi-res PixelSense display, perfect for viewing documents and websites. Enjoy cinematic sound with Dolby Atmos and crisp video calls with a 720p webcam. Exceptional typing comfort with optimized key travel and a large trackpad.</p>",,,taxable,,1,,,0,0,,,,,1,,,"1299,99","PC Components > Laptop > Microsoft",,,https://webmall-1.informatik.uni-mannheim.de/wp-content/uploads/2025/05/2938-scaled.jpg,,,,,,,,,0,,xcase.co.uk_53,2938,1,uag-css-1907.css,
1908,simple,,,"Akasa AK-455 Heat Paste, 0.87ml (1.5g) with Syringe, Hi-performance, OEM - No Spreader or Manual",1,0,visible,,"<p>New improved formulated thermal compound AK-455 provides hi-performance heat transfer between the CPU and heatsink. It minimizes resistance and maximizes efficiency, enabling you to get more from your cooler. Easy to use and RoHS compliant.</p>",,,taxable,,1,,,0,0,,,,,1,,,"9,99","PC Components > Thermal Pads > Akasa",,,https://webmall-1.informatik.uni-mannheim.de/wp-content/uploads/2025/05/2942.jpg,,,,,,,,,0,,xcase.co.uk_969,2942,1,,
1909,simple,,,"Asus ROG Strix Helios RGB White Gaming Case w/ Tempered Glass Windows, E-ATX, GPU Braces, USB-C, Fan/RGB Controls, Carry Handles",1,0,visible,,"<p>ROG Strix Helios RGB ATX/EATX mid-tower gaming case with tempered glass, aluminum frame, GPU braces, and advanced I/O panel. Designed for showcase builds with integrated Aura Sync RGB lighting and effortless cable management.</p>",,,taxable,,1,,,0,0,,,,,1,,,"199,99","PC Components > Cases > Asus",,,https://webmall-1.informatik.uni-mannheim.de/wp-content/uploads/2025/05/2946.jpg,,,,,,,,,0,,xcase.co.uk_1031,2946,1,uag-css-1909.css,1
1910,simple,,,"Asus 34"" ROG STRIX UWQHD Ultra-wide Curved Gaming Monitor (XG349C), 3440 x 1440, 1ms, OC 180Hz, sRGB, HDMI, DP,  USB, Speakers, RGB, VESA",1,0,visible,,"<p>ROG Strix XG349C Gaming Monitor - 34 inch UWQHD (3440 x 1440), overclockable 180Hz, 1ms response time, G-Sync compatible, and USB Type-C hub for seamless connectivity.</p>",,,taxable,,1,,,0,0,,,,,1,,,"999,99","Peripherals > Monitor > Asus",,,https://webmall-1.informatik.uni-mannheim.de/wp-content/uploads/2025/05/2951.jpg,,,,,,,,,0,,xcase.co.uk_428,2951,1,uag-css-1910.css,
1911,simple,,,"Asus 27"" Frameless Eye Care Gaming Monitor (VA27DQFR), IPS, 1920 x 1080, 1ms, 100Hz, VGA, HDMI, DP, Adaptive-Sync, VESA",1,0,visible,,"<p>ASUS VA27DQFR Eye Care Gaming Monitor - 27-inch, IPS, Full HD (1920x1080), 100Hz refresh rate, Adaptive-Sync technology, and rich connectivity options including HDMI and DisplayPort.</p>",,,taxable,,1,,,0,0,,,,,1,,,"199,99","Peripherals > Monitor > Asus",,,https://webmall-1.informatik.uni-mannheim.de/wp-content/uploads/2025/05/2955.png,,,,,,,,,0,,xcase.co.uk_131,2955,1,uag-css-1911.css,1
1912,simple,,,"Asus ProArt RTX4070 SUPER OC, 12GB DDR6X, HDMI, 3 DP, 2565MHz Clock, Overclocked, Compact 2.5 Slot Design",1,0,visible,,"<p>SUPER OC Edition 12GB GDDR6X brings elegant and minimalist style to empower creator PC builds with full-scale GeForce RTX™ 40 SUPER Series performance. NVIDIA Studio RTX and AI-accelerated creator apps, exclusive AI software, and Studio Drivers for unmatched creativity and performance.</p>",,,taxable,,1,,,0,0,,,,,1,,,"599,99","PC Components > GPU > Asus",,,https://webmall-1.informatik.uni-mannheim.de/wp-content/uploads/2025/05/2962.png,,,,,,,,,0,,xcase.co.uk_343,2962,1,uag-css-1912.css,9
1913,simple,,,"Fractal Design North XL Chalk White (TG Clear) Case w/ Clear Glass Window, E-ATX, 3 PWM Fans, USB-C, Oak Front",1,0,visible,,"<p>Transformative design in a generous format. North XL offers a stylish addition to any living space while helping components stay cool. Designed for E-ATX / ATX / mATX / mITX motherboards, it includes three 140 mm Aspect PWM fans and features a spacious interior layout.</p>",,,taxable,,1,,,0,0,,,,,1,,,"139,99","PC Components > Cases > Fractal Design",,,https://webmall-1.informatik.uni-mannheim.de/wp-content/uploads/2025/05/2970.jpg,,,,,,,,,0,,xcase.co.uk_167,2970,1,uag-css-1913.css,
1914,simple,,,"Fractal Design North XL Chalk White (White Solid) Case, E-ATX, Fine Mesh Side, 3 PWM Fans, USB-C, Oak Front",1,0,visible,,"<p>Transformative design in a generous format. North XL offers a stylish addition to any living space with fine-patterned mesh ventilation and an FSC-certified oak panel. It features a spacious interior layout, designed for E-ATX / ATX / mATX / mITX motherboards, and includes three 140 mm Aspect PWM fans for optimal cooling.</p>",,,taxable,,1,,,0,0,,,,,1,,,"159,99","PC Components > Cases > Fractal Design",,,https://webmall-1.informatik.uni-mannheim.de/wp-content/uploads/2025/05/2971.jpg,,,,,,,,,0,,xcase.co.uk_410,2971,1,uag-css-1914.css,
1915,simple,,,"Asus ROG FALCHION ACE Compact 65% Mechanical RGB Gaming Keyboard, Wired (Dual USB-C), ROG NX Red Switches, Per-key RGB Lighting, Touch Panel",1,0,visible,,"<p>ROG Falchion Ace 65% compact gaming keyboard with pre-lubed ROG NX mechanical switches, PBT doubleshot keycaps, sound-dampening foam, interactive touch panel, dual Type-C ports, and three keyboard tilt angles for comfort.</p>",,,taxable,,1,,,0,0,,,,,1,,,"149,99","Peripherals > Keyboard > Asus",,,https://webmall-1.informatik.uni-mannheim.de/wp-content/uploads/2025/05/2973.jpg,,,,,,,,,0,,xcase.co.uk_764,2973,1,uag-css-1915.css,3
1916,simple,,,"Asus ROG FALCHION ACE Compact 65% Mechanical RGB Gaming Keyboard, Wired (Dual USB-C), ROG NX Red Switches, Per-key RGB Lighting, Touch Panel, White Edition",1,0,visible,,"<p>ROG Falchion Ace 65% compact gaming keyboard with pre-lubed ROG NX mechanical switches, PBT doubleshot keycaps, sound-dampening foam, interactive touch panel, dual Type-C ports, and three keyboard tilt angles for comfort.</p>",,,taxable,,1,,,0,0,,,,,1,,,"149,99","Peripherals > Keyboard > Asus",,,https://webmall-1.informatik.uni-mannheim.de/wp-content/uploads/2025/05/2974.jpg,,,,,,,,,0,,xcase.co.uk_1024,2974,1,uag-css-1916.css,2
1917,simple,,,"GameMax Hype Gaming Case w/ Glass Side &amp; Front, ATX, Dual Chamber, 3x ARGB Fans, ARGB PWM Hub &amp; RF Remote Control, USB-C, White",1,0,visible,,"<p>Raise your level with the GameMax Hype Mid-Tower gaming case. This ATX chassis features three tempered glass panels for a panoramic view of your hardware. With three pre-installed GameMax Infinity ARGB Dual-Ring fans, it ensures optimal cooling. The dual-chamber design keeps your drives and cables hidden while showcasing your components. The I/O panel includes USB3.0 and Type-C connections, and the included ARGB hub allows for extensive lighting customization.</p>",,,taxable,,1,,,0,0,,,,,1,,,"89,99","PC Components > Cases > GameMax",,,https://webmall-1.informatik.uni-mannheim.de/wp-content/uploads/2025/05/2979.jpg,,,,,,,,,0,,xcase.co.uk_433,2979,1,,
1918,simple,,,"ADATA XPG Lancer Blade 16GB, DDR5, 5600MHz (PC5-44800), CL46, 1.1V, ECC, PMIC, XMP 3.0, AMD EXPO, DIMM Memory",1,0,visible,,"<p>The ADATA XPG Lancer Blade features a sleek low-profile heatsink design, PMIC for power stability, and on-die ECC for enhanced reliability. It supports Intel XMP 3.0 and AMD EXPO for easy overclocking, making it ideal for gamers and overclockers.</p>",,,taxable,,1,,,0,0,,,,,1,,,"75,99","PC Components > Memory > ADATA",,,https://webmall-1.informatik.uni-mannheim.de/wp-content/uploads/2025/05/2982.png,,,,,,,,,0,,xcase.co.uk_295,2982,1,,
1919,simple,,,"Asus ROG Hyperion GR701 Gaming Case w/ Glass Windows, E-ATX, 4x 14cm Fans, Dual 420mm Radiator Support, USB-C (60W FC), Fan Hub &amp; Lighting Panel, White",1,0,visible,,"<p>ROG Hyperion GR701 E-ATX computer case with dual 420 mm radiator support, four 140 mm fans, and a built-in fan hub for optimal airflow. Features tool-free side panels, integrated graphics card holder, and USB-C fast charging.</p>",,,taxable,,1,,,0,0,,,,,1,,,"199,99","PC Components > Cases > Asus",,,https://webmall-1.informatik.uni-mannheim.de/wp-content/uploads/2025/05/2986.png,,,,,,,,,0,,xcase.co.uk_531,2986,1,uag-css-1919.css,1
1920,simple,,,"Asus ROG Hyperion GR701 BTF Gaming Case w/ Glass Windows, E-ATX, 4x 14cm Fans, Dual 420mm Radiator Support, USB-C (60W FC), Fan Hub &amp; Lighting Panel, Asus BTF Compatible, Black",1,0,visible,,"<p>ROG Hyperion GR701 BTF Edition E-ATX computer case with hidden connectors design, dual 420 mm radiator support, four 140 mm fans, and 60W fast charging. Features include tool-free side panels, built-in storage drawer, and a premium aluminum frame.</p>",,,taxable,,1,,,0,0,,,,,1,,,"199,99","PC Components > Cases > Asus",,,https://webmall-1.informatik.uni-mannheim.de/wp-content/uploads/2025/05/2987.png,,,,,,,,,0,,xcase.co.uk_1079,2987,1,uag-css-1920.css,
1921,simple,,,"PNY T1000 Professional Graphics Card, 4GB DDR6, 896 Cores, 4 miniDP 1.4, Low Profile (Bracket Included), OEM (Brown Box)",1,0,visible,,"<p>Full Performance in a Small Form Factor Solution. NVIDIA T1000 delivers more performance than the previous generation, allowing you to work with larger models and ensuring hardware compatibility with the latest standards. Supports up to four 5K displays or two 8K displays per card.</p>",,,taxable,,1,,,0,0,,,,,1,,,"399,99","PC Components > GPU > PNY",,,https://webmall-1.informatik.uni-mannheim.de/wp-content/uploads/2025/05/2991.jpg,,,,,,,,,0,,xcase.co.uk_918,2991,1,uag-css-1921.css,5
1922,simple,,,"Corsair Vengeance LPX 64GB Kit (2 x 32GB), DDR4, 3200MHz (PC4-25600), CL16, XMP 2.0, DIMM Memory",1,0,visible,,"<p>VENGEANCE LPX memory is designed for high-performance overclocking with a pure aluminum heatspreader for faster heat dissipation and superior overclocking headroom. Each IC is individually screened for peak performance potential.</p>",,,taxable,,1,,,0,0,,,,,1,,,"299,99","PC Components > Memory > Corsair",,,https://webmall-1.informatik.uni-mannheim.de/wp-content/uploads/2025/05/2995.jpg,,,,,,,,,0,,xcase.co.uk_329,2995,1,uag-css-1922.css,
1923,simple,,,"Corsair Vengeance LPX 32GB Kit (2 x 16GB), DDR4, 3000MHz (PC4-24000), CL16, XMP 2.0, DIMM Memory",1,0,visible,,"<p>VENGEANCE LPX memory is designed for high-performance overclocking with a pure aluminum heatspreader for faster heat dissipation. Each module is built from a custom performance PCB and highly-screened memory ICs, ensuring reliable performance and compatibility.</p>",,,taxable,,1,,,0,0,,,,,1,,,"129,99","PC Components > Memory > Corsair",,,https://webmall-1.informatik.uni-mannheim.de/wp-content/uploads/2025/05/2996.jpg,,,,,,,,,0,,xcase.co.uk_1040,2996,1,uag-css-1923.css,1
1924,simple,,,"Corsair Vengeance 32GB Kit (2 x 16GB), DDR5, 5200MHz (PC5-41600), CL40, 1.25V, AMD Optimised, PMIC, DIMM Memory",1,0,visible,,"<p>CORSAIR VENGEANCE DDR5, optimized for AMD® motherboards, delivers higher frequencies and greater capacities of DDR5 technology in a high-quality, compact module. With onboard voltage regulation and custom AMD EXPO profiles, it ensures your high-end CPU gets data quickly, making it ideal for gaming, content creation, and multitasking.</p>",,,taxable,,1,,,0,0,,,,,1,,,"139,99","PC Components > Memory > Corsair",,,https://webmall-1.informatik.uni-mannheim.de/wp-content/uploads/2025/05/3000.jpg,,,,,,,,,0,,xcase.co.uk_856,3000,1,uag-css-1924.css,2
1925,simple,,,"PNY RTXA400 Professional Graphics Card, 4GB DDR6, 4 miniDP 1.4 (4x DP adapters), 768 CUDA Cores, Low Profile (Bracket Included), Retail",1,0,visible,,"<p>Performance for endless possibilities. The NVIDIA RTX A400, built on the NVIDIA Ampere GPU architecture, brings the power of AI and ray-tracing acceleration into the hands of more professionals. The RTX A400 ensures AI-powered workflows and stunning ray-traced visuals are delivered with unprecedented performance in a space-saving design. Plus, you can connect up to four native displays to expand your visual horizons.</p>",,,taxable,,1,,,0,0,,,,,1,,,"299,99","PC Components > GPU > PNY",,,https://webmall-1.informatik.uni-mannheim.de/wp-content/uploads/2025/05/3006.png,,,,,,,,,0,,xcase.co.uk_624,3006,1,uag-css-1925.css,5
1926,simple,,,"Fractal Design Torrent Compact (Black Solid) Gaming Case, E-ATX, 2 Fans, Fan Hub, Front Grille, USB-C",1,0,visible,,"<p>The Torrent Compact is built to air cool your compact build as efficiently as possible through an open front grille and two 180 mm Dynamic PWM fans, making it a perfect fit for air cooling aficionados looking for a compact case. Comes with the new Nexus 9P Slim PWM fan hub pre-installed, removable top bezel and routing clips for easy installation and cable management, and supports E-ATX motherboards up to 274 mm wide.</p>",,,taxable,,1,,,0,0,,,,,1,,,"129,99","PC Components > Cases > Fractal Design",,,https://webmall-1.informatik.uni-mannheim.de/wp-content/uploads/2025/05/3019.jpg,,,,,,,,,0,,xcase.co.uk_739,3019,1,uag-css-1926.css,
