1964,simple,,,"Canon EOS R50 with RF-S 18-45mm",1,0,visible,,"The Canon EOS R50 camera can capture images and videos with reduced noise, delivering clear, detailed results even in low light. Images look beautiful even when enlarged, with natural bokeh that smartphones can’t offer.nDual Pixel CMOS AF IInEasily keep track of your subject with Dual Pixel CMOS AF II – a highly responsive system that covers up to approximately 100% x 100% of the picture area, breaking the image into up to 651 automatically-selected AF zones during Whole Area AF. This enables impressive autofocus coverage on the EOS R50 camera that helps you get the photo you want right as the moment happens.nAutomatic Subject Detection and TrackingnWhen the subject is found on screen, the EOS R50 camera can automatically select and track the subject, enabling photography that keeps them in focus with ease. Developed using Deep Learning Technology, subjects like people, animals including dogs, cats and birds, and vehicles such as cars and motorcycles — especially in a motorsports environment – are detectable.nContinuous ShootingnCapture those can’t-miss moments with up to 12 frames per second continuous shooting using the Electronic First Curtain shutter mode, and up to 15 frames per second with Electronic Shutter mode. Electronic First Curtain enables shooting with less distortion, even for subjects with significant movement. The Electronic Shutter generates no shutter noise, making it useful when photographing sleeping children, concerts, dance recitals, and other situations where silence is necessary.nAdvanced A+ AssistnExperience the joy of creative photography with an expanded array of auto-compatible scenes. Advanced A+ Assist on the EOS R50 camera enables great imagery even in difficult settings such as night views and backlit scenarios. Overexposure is automatically reduced so you can capture dynamic scenes or bright portraits, and multiple continuous shots are taken to create beautiful night images or macro photography with a deeper depth of field.nVlogging Made Simple and ConvenientnWith video recording features such as 6K oversampled uncropped 4K movie at up to 30 fps, Full-HD High-frame rate movie recording at up to 120 fps, Dual Pixel CMOS AF tracking, and Movie for Close-up Demo Mode, the EOS R50 camera makes vlogging and video content creation simple and convenient.nContinuous Movie Recording That Exceeds 30 MinutesnThe EOS R50 camera can continuously record video for up to 1 hour, allowing you to set up your video and keep your vlog, podcast, or other video project rolling without worrying about it stopping.nMovie for Close-Up Demos ModenEnsure the correct subject is in focus with Movie for Close-up Demos Mode on the EOS R50 camera. This mode quickly switches focus from the on-camera subject to an object that is presented towards the camera’s lens, ideal for movies where showing a product to the viewers is necessary such as in makeup demos, or cooking videos.nVertical Movie Mode and Aspect MarkersnMovie rotation information can be set during or after movie recording, allowing videos to be played in vertical composition when viewing on a smartphone. The Aspect Markers Function displays visual markers for different aspect ratios that may be desired for posting the same file to various social media sites. This display provides consideration for proper composition for the different deliverable files that can be created when editing.nUVC/UAC compatibility allows the EOS R50 camera to be used as a web camera to stream live video in Full HD 30 fps fixed, without additional computer software, to applications such as Zoom™, Microsoft Teams™, Skype™, and similar on-line web conferencing software.nVari-Angle Touchscreen LCDnFeaturing a 3.0-inch, 1.62 million dot Clear View LCD II Vari-angle Touchscreen LCD, the EOS R50 makes it easy to compose and shoot from virtually any angle. With the EOS R50 Touch and Drag AF functionality, you can intuitively and swiftly move the autofocus point on the touch-panel LCD.nPrecise Electronic ViewfindernThe EOS R50 camera is equipped with a high-precision 0.39-inch OLED (Organic Light-Emitting Diode) EVF with approx. 2.36 million dots and a 22mm eyepoint which displays a bright image and extensive shooting information. The EVF supports up to a 120 fps refresh rate and has been designed to provide a bright, sharp and colorful 100% view of the subject at hand. There’s also an Optical Viewfinder (OVF) Simulation setting, which provides a higher dynamic range viewfinder image for outstanding viewing in harsh, contrasty lighting situations.nWired and Wireless CommunicationsnThe EOS R50 camera supports both wired and wireless connections to your smartphone via its USB Type-C port, built-in Wi-Fi®, and Bluetooth® technology, making it easy to upload and share movies and photos to your favorite social networks.nBuilt-in Bluetooth® CapabilitynBluetooth® pairing helps you connect the camera to compatible smart devices using the free Canon Camera Connect app. This low-energy wireless connection helps preserve battery life, while providing remote control of the camera. It also sends continuously updated GPS location data from your phone, letting you geotag what you've captured so you know precisely where you captured the photo.nBuilt-in Wi-Fi CapabilitynEnable wireless functions, such as remote live view, file viewing and transfer, by connecting to Wi-Fi quickly and seamlessly. Using the Canon Camera Connect app, you can also transfer files to your mobile device to browse and share on social media.nUSB-C ConnectionnThe EOS R50 camera can be connected to a computer or smartphone via USB-C. All Canon Camera Connect app features that can be used with Wi-Fi are now available when the camera and smartphone are connected via USB, using a compatible cable for your device.",,,taxable,,1,,,0,0,,,,,1,,,"700,0","Cameras > Digital > Canon",,,https://webmall-1.informatik.uni-mannheim.de/wp-content/uploads/2025/05/3122.jpg,,,,,,,,,0,,thecamerastore.com_1740,3122,1,uag-css-1964.css,
1965,simple,,,"Canon EOS R5 C Cinema Mirrorless Camera Body",1,0,visible,,"Buy the Canon EOS R5 C Mirrorless Cinema Camera that is for sale for the best price online at Foto Discount World in South Africa.  The Canon EOS R5 C is perfect for all the wedding videographers, drone camera operators, and multimedia journalists who have professional photo still and cinema video production needs, get ready for a new type of shooting experience with the EOS R5 C Mirrorless Cinema Camera from Canon. With a simple switch, the R5 C is a full featured still photo camera with all the settings of the R5 EOS mirrorless camera.",,,taxable,,1,,,0,0,,,,,1,,,"5000,0","Cameras > Digital > Canon",,,https://webmall-1.informatik.uni-mannheim.de/wp-content/uploads/2025/05/3124.jpg,,,,,,,,,0,,fotodiscountworld.co.za_31,3124,1,uag-css-1965.css,
1966,simple,,,"Canon EOS R5, RF 24-105mm f/4L IS USM",1,0,visible,,"Canon EOS R5, RF 24-105mm F/4L IS USMnnTHE EXPECTED DELIVERY DATE MAY VARY DUE TO PRODUCT AVAILABILITYnnnKey Featuresnnn45MP Full-Frame CMOS SensornDIGIC X Image Processorn8K30 Raw and 4K120 10-Bit Internal VideonSensor-Shift 5-Axis Image Stabilizationnn nnnnFor the professional image-maker who needs resolution, speed, and video capabilities, there is the Canon EOS R5. Setting a new standard for versatility, this full-frame mirrorless camera features a newly developed 45MP CMOS sensor, which offers 8K raw video recording, 12 fps continuous shooting with a mechanical shutter, and is the first EOS camera to feature 5-axis sensor-shift image stabilization.nBeyond just resolution, the sensor also pairs with the refined DIGIC X image processor to usher in a new generation of Dual Pixel CMOS AF for quick, smooth, and intelligent focusing performance using 1053 selectable points that cover the entire field of view. This focusing system has also been updated to make use of Deep Learning technology for improved subject tracking as well as precise eye, face, and head-detection for both people and animals.nComplementing the imaging assets, the R5, while sporting a new design, also feels familiar to EOS 5-series users. An especially high-resolution 5.76m-dot electronic viewfinder provides a realistic 120 fps refresh rate while the rear touchscreen LCD monitor sports a vari-angle design to accommodate vlogging needs as well as benefit working from high and low angles. A top status makes for an intuitive workflow and the camera also incorporates dual memory card slots—one CFexpress Type B, one SD UHS-II—along with Bluetooth and Wi-Fi wireless connectivity.nnnnnnnn45MP Full-Frame Sensor and DIGIC X ProcessornnBuilt around a newly developed 45MP full-frame CMOS sensor, the EOS R5 offers both high-resolution stills and video output and the fine-tuned DIGIC X image processor complements this with a wealth of speed. Sensitivity from ISO 100-51200, which can be expanded to ISO 102400, suits working in a variety of lighting conditions while quick continuous shooting up to 12 fps with a mechanical shutter, or silent 20 fps with an electronic shutter, is ideal for working with moving subjects.nnnnnn8K30 Raw and 4K120 Video RecordingnnBenefitting more than just stills, the 45MP full-frame sensor also enables impressively high-resolution DCI and UHD 8K 30 fps raw video recording internally along with 4K recording up to 120 fps in 4:2:2 10-bit with Canon Log. HDR-PQ recording is possible, too, in-camera HDR production and external recording, via the HDMI port supports a clean 4K output at up to 60 fps. Both All-I and IPB compression options are available, along with the ability to use Dual Pixel CMOS AF when shooting at up to 8K raw.nnnnnnDual Pixel CMOS AFnnAn updated Dual Pixel CMOS AF features 1053 selectable focusing points, which cover approximately 100% of the image frame for wide and even coverage. This focusing system offers smooth and fast focusing performance in a similar manner to how a camcorder acquires focus. This system integrates two separate photodiodes within each pixel to provide a broad and dense network of phase-detection gathering elements across a majority of the image sensor to reduce focus hunting for faster, more direct control of focus placement. When working with still imagery, this focusing system works to acquire focus quickly and accurately, making it ideally suited to shooting and tracking moving subjects so that critical focus is attained with each shot. When shooting video, a Movie Servo AF mode offers smooth and natural focusing when changing from different subjects or different distances within the scene, as well as the ability to specify tracking sensitivity, AF speed, and Face Tracking priority. Benefited by the Touch AF system, rack focus is possible simply by touching elements within the scene on the touchscreen in order to change focus in an intuitive manner. Subject tracking in movies is also heightened due to the Dual Pixel CMOS AF system's ability to recognize subjects and maintain focus when working within changing or cluttered scenery.Subject tracking has also been benefitted through the use of Deep Learning technology, which helps to gradually refine the focusing system's ability to quickly and accurately recognize both people and animal subjects. This technology also supports the more refined eye, face, and head detection functions, for both people and animals, that are well-suited for portraiture applications.nnnnnnSensor-Shift Image StabilizernnA first for EOS cameras, the R5 incorporates five-axis sensor-shift image stabilization that compensates for up to an impressive eight stops of camera shake for truly effective compensation of camera shake to suit handheld shooting with slower shutter speeds. This stabilization system also works in concert with lens-based optical image stabilization for both native RF lenses and adapted EF lenses.nnnnnnBody Design and Wireless ConnectivitynnnnHigh-resolution 5.67m-dot 0.5"" electronic viewfinder provides a bright and detailed means for eye-level viewing and the quick 120 fps refresh rate offers natural motion rendering for a more realistic viewfinder experience.nRear 3.2"" LCD touchscreen features a vari-angle design that benefits front-facing recording, such as for vlogging needs, as well as working from high and low shooting angles.nTop status LCD can be used to quickly review camera and shooting settings.nCFexpress Type B and SD UHS-II memory card slots are featured for flexible storage needs; the CFexpress slot is ideal for 8K video and high-speed, high-resolution burst shooting needs while the SD card slot retains a familiar form factor for wide compatibility.nBoth a 3.5mm headphone and a 3.5mm external microphone port are featured for improved audio monitoring and recording capabilities.nRefined body design incorporates four distinct control dials across the body for intuitive tactile control and a joystick controller is used on the back of the camera for fast and intuitive focus point selection and menu navigation.nDurable, weather-sealed body design is built to handle tough working conditions and inclement weather.nBoth 5 GHz and 2.4 GHz Wi-Fi bands are available for fast file transferring to a mobile device and Bluetooth is also available to provide constant device connection via the Canon Camera Connect app.nnnnnnnnRF 24-105mm f/4L IS USM LensnnIncluded with the camera body is the versatile RF 24-105mm f/4L IS USM lens; a standard zoom covering wide-angle to portrait-length focal lengths. Its f/4 constant maximum aperture maintains consistent performance throughout the zoom range and suits working in a variety of lighting conditions. An Image Stabilizer also suits photographing in low-light by compensating for the effects of camera shake to result in sharper imagery when shooting handheld. Benefitting both stills and video applications, it also has an Ultrasonic Motor that delivers quick, quiet, and precise autofocus performance along with full-time manual focus override.nnnnn",,,taxable,,1,,,0,0,,,,,1,,,"4000,0","Cameras > Digital > Canon",,,https://webmall-1.informatik.uni-mannheim.de/wp-content/uploads/2025/05/3129.jpg,,,,,,,,,0,,avcstore.com_823,3129,1,uag-css-1966.css,
1967,simple,,,"Canon EOS R5 Mirrorless Camera Body",1,0,visible,,"Building on the established legacy of Canon full frame cameras and the successful EOS R and RP mirrorless cameras, the Canon EOS R5 Mirrorless Digital Camera Body brings next-generation processing power, image quality, performance and build quality to the market. It’s the ideal camera for photographers and cinematographers who are looking for cutting-edge technology for anything from weddings, portraits, sports, landscape, high-end cinema, and more.nn  NEW FIRMWARE UPDATEnnnnnCutting-edge quality with an all-new 45MP CMOS sensornAt the heart of the EOS R5 is a newly developed, 45MP full frame CMOS sensor. The highest resolution mirrorless camera available from Canon, the R5 will excel when shooting even the most demanding of subjects. Thanks to this incredibly high resolution, the finest details will be realized, and photographers will have the ultimate flexibility with both enlarging their images, or cropping to realize creative vision expressed in post-processing.nDIGIC X image processornIf the 45MP CMOS sensor is the heart of the R5, the brain is undoubtedly the DIGIC X image processor. Originally introduced in the EOS 1D X Mark III DSLR, the DIGIC X processor allows an unbelievable ISO range of 100-51200. Thanks to this, shooting in less than ideal lighting conditions or with slower lenses is no longer a limitation. Expandable up to 10,400, the R5 will be able to capture detail and retain image quality in nearly any lighting environment thanks to the DIGIC X.nBigger files does not mean slower performancenUnlike previous high resolution digital cameras, the added resolution of the EOS R5 does not come at the expense of speed. Shooting speeds of up to 12 fps with the mechanical shutter, or 20 fps when shooting with the electronic silent shutter, allows photographers to capture split-second details among even the fastest-moving subjects. Whether it’s a snowboarder in the half pipe, or a bride assaulting her new hubby with the wedding cake, subjects will be captured in full detail, with autofocus keeping them tack-sharp throughout the shooting sequence.nIn-Body Image Stabilizer IBISnThe EOS R5 is Canon’s first camera to incorporate a 5-axis in-body image stabilization (IBIS). Thanks to this new system, any lens used on the EOS R5 becomes stabilized, and when used with Canon EF &amp; RF lenses that incorporate optical image stabilization technology, the camera’s built-in system works in conjunction to allow for an industry leading 8-stops of shake correction.nDeep learning AF technologynFace and eye AF technology is not new, but the EOS R5 is bringing the concept to a whole new level. The R5 utilizes a learning technology to locate a person’s head or eye when people detection is set, allowing for easier and more accurate subject tracking while shooting. Additionally, the R5 is incorporating animal detection for the first time in a Canon camera, which will allow the R5 to effectively track the body, face or eyes of cats, dogs or birds, regardless of the animal’s size, posture, or orientation of the face.n8K RAW videonThanks to the 45MP CMOS sensor, combined with the processing powerhouse of the DIGIC X, the R5 has the ability to record 8K movies, uncrossed, at up to 30 fps (29.97 fps). 4K video shooting up to 119.9 fps in 4:2:2 10-bit Canon Log, with Dual Pixel CMOS AF is also available in all 8K and 4K video modes. Internal recording is now available thanks to the use of CFexpress memory cards, eliminating the need for expensive external recorders.nUnparalleled durabilitynIn spite of its lightweight and comfortable design, the EOS R5 is built to last. A rigid magnesium alloy chassis enhances body durability, while shielding the camera from electromagnetic radiation and heat. Internal seals in critical areas like buttons, terminal covers, battery compartment, and card slot cover allow the camera to work flawlessly in a variety of poor weather conditions, and a newly designed shutter, rated up to 500k cycles, provides years of shooting enjoyment.nn",,,taxable,,1,,,0,0,,,,,1,,,"2799,0","Cameras > Digital > Canon",,,https://webmall-1.informatik.uni-mannheim.de/wp-content/uploads/2025/05/3131.webp,,,,,,,,,0,,pictureline.com_942,3131,1,uag-css-1967.css,
1968,simple,,,"4TB Crucial MX500 SSD with cloning kit",1,0,visible,,"rnrnALL YOU NEED TO CLONE YOUR PCrnThis kit includes the MX500 SSD, and instructions on how to download Acronis for Crucial rnedition and a USB to SATA cable.rnUse the link in the instructions to download Acronis. Connect the USB cable into your computer rnand the other end into the new SSD. Run rnAcronis and clone from your current drive to the new drive. When it is finished cloning, shut your rncomputer down and replace the drive rnwith the new SSD. Reboot and enjoy! We will included detailed printed cloning instructions with rnyour SSD, and if you need it, free rntechnical support over the phone for any questions about the SSD, clone or install.rnPlease note: This upgrade kit is an Upgradeable exclusive product, it is not available rnfrom anywhere else. We have put together rnthe best components to make a cloning kit we would use.rn rnrnrnIs Upgrading to an SSD worth it? rnrnIf you are using an older style mechanical hard drive, it is transferring data at 50mb per rnsecond. A Crucial SSD will transfer data at over 500mb per second, that is the top speed of the SATA rnbus. rnThis is why we say an SSD will improve your computer's performance by 5x. It will feel like 10x! rnWe offer a guarantee, if it does not improve the computer's speed, send it back for a full refund. rnWith an SSD installed, everything becomes snappy again, apps load instantly, the computer boots up quickly, you feel like rnyou have a new computer. rnrnIf you never have upgrade a hard drive, don't worry, we have you covered. Easy printed rninstructions, how-to videos and real local live phone support.rnrnTo upgrade to a new SSD the process is: clone your old drive to new SSD, replace old drive rnwith new SSD, restart your computer and enjoy your life again! It really is that easy. rnrnSpeed: SATA 6.0Gb/s  at 560 MB/s Read, 510 MB/s WriternrnService and Support: 5 year warranty, with Upgradeable's customer rnservice and technical support in Australia and New Zealand (backed by a real physical office and rnlocal technicians), we guarantee our phones are answered by live in-house staff.rnrnCompatibility: Compatible with PC, Mac and Linux systems. rnrnHow this SSD benefits YOUrnrnrntStart your system in secondsrntLoad files almost instantlyrntAccelerate your most demanding applicationsrntStore massive amounts of data with drive capacities up to 4TBrntBe more efficient with Micron 3D NAND rntEnjoy a cooler, quieter computer and extend laptop battery life using only 100 mW of rnpowerrntKeep all your saved work if power is unexpectedly cut with Integrated Power Loss rnImmunityrntGet a high price-to-performance ratio without needing a financing plan to pay for rnitrntProtect your data on a drive that’s tried, tested, and proven from start to finishrntBlock hackers and thieves with AES 256-bit hardware-based encryptionrntClone your old drive with Acronis for Crucial software (Free download)rntManage and improve your SSD with the Crucial Storage Executive tool (PC only)rnt5-year warrantyrn rnrnrntrnttrntttMX500 SSD SpecificationsrnttrntrntrnttrntttBrandrntttCrucialrnttrnttrntttForm Factorrnttt2.5-inch internal rnSSDrnttrnttrntttTotal Capacityrnttt4TBrnttrnttrntttWarrantyrnttt5 yearrnttrnttrntttSpecsrnttt4TB 2.5-inch internal rnSSD • SATA 6.0Gb/s • 560 MB/s Read, rn510 MB/s WriternttrnttrntttSeriesrntttMX500rnttrnttrntttProduct LinerntttKick arse SSDrnttrnttrntttInterfacerntttSATA 6.0Gb/srnttrnttrntttDevice TyperntttInternal Solid State rnDrivernttrnttrntttUnit Heightrnttt7.0mmrnttrnttrntttForm Factorrnttt2.5-inch (7mm)rnttrnttrntttPackage Contentrnttt2.5-inch 7mm SSD rnSATA 6Gb/s, 7mm to 9.5mm spacer, Acronis rnfor Crucial cloning software and installation instructionsrnttrntrnrnrnrnrn Mac Upgrade guides for SSDsrnrnMacbook Pro SSD guiderniMac SSD guidernMacbook Air SSD guidernMac Mini SSD guidernMac Pro SSD guidernHow to clone your Mac with rnSuperduperrnrn PC Upgrade guides for SSDsrnrnHow to clone your PC using rnAcronisrnHow to clone your PC using rnMacrium rnrnrn",,,taxable,,1,,,0,0,,,,,1,,,"551,0","Electronics > SSD > Crucial",,,https://webmall-1.informatik.uni-mannheim.de/wp-content/uploads/2025/05/3132.jpg,,,,,,,,,0,,upgradeable.co.nz_46,3132,1,uag-css-1968.css,4
1969,simple,,,"2TB Crucial MX500 SSD",1,0,visible,,"2TB Crucial MX500 SSDSpecifications:Capacity: 2TBModel: Crucial MX500 SSDDevice Type: 2.5in (7mm) SATA 6Gb/s Solid-State DriveSpeed: 560MB/s read, 510MB/s writePort type: SATA 2.5 inchWarranty: Five YearsBrand: UpgradeableBrand Series: Solid-State Drives",,,taxable,,1,,,0,0,,,,,1,,,"236,0","Electronics > SSD > Crucial",,,https://webmall-1.informatik.uni-mannheim.de/wp-content/uploads/2025/05/3136.jpg,,,,,,,,,0,,upgradeable.com.au_523,3136,1,uag-css-1969.css,
1970,simple,,,"CRUCIAL MX500 500GB M.2  SSD",1,0,visible,,"&amp;nbsp;nn tSequential reads/writes up to 560/510 MB/s and random reads/writes up to 95k/90k on all file typesn tAccelerated by Micron 3D NAND technologyn tIntegrated Power Loss Immunity preserves all your saved work if the power unexpectedly gets cutn tAES 256-bit hardware-based encryption keeps data safe and secure from hackers and thievesn tCrucial 5-year limited warranty",,,taxable,,1,,,0,0,,,,,1,,,"6474,6","Electronics > SSD > Crucial",,,https://webmall-1.informatik.uni-mannheim.de/wp-content/uploads/2025/05/3140.jpg,,,,,,,,,0,,gamesncomps.com_100,3140,1,uag-css-1970.css,
1971,simple,,,"Samsung 2TB 870 EVO SATA Internal SSD",1,0,visible,,"Sequential Read Speed: Up to 560 MB/sn tSequential Write Speed: Up to 530 MB/sn tAES 256-bit Encryptionn tSKU: MZ-77E2T0BWn t5 Years Warranty",,,taxable,,1,,,0,0,,,,,1,,,"200,0","Electronics > SSD > Samsung",,,https://webmall-1.informatik.uni-mannheim.de/wp-content/uploads/2025/05/3144.jpg,,,,,,,,,0,,gamesncomps.com_360,3144,1,uag-css-1971.css,
1972,simple,,,"Samsung 870 EVO 2.5"" 250 GB SATA III V-NAND",1,0,visible,,"Samsung 870 EVO 2.5"" 250 GB SATA III V-NAND",,,taxable,,1,,,0,0,,,,,1,,,"42,5","Electronics > SSD > Samsung",,,https://webmall-1.informatik.uni-mannheim.de/wp-content/uploads/2025/05/3150.jpg,,,,,,,,,0,,urstore.nl_210,3150,1,uag-css-1972.css,1
1973,simple,,,"Smartphone SAMSUNG Galaxy A15 4/128GB Black SM-A155FZKDEUE",1,0,visible,,"Smartphone SAMSUNG Galaxy A15 4/128GB Black SM-A155FZKDEUE.",,,taxable,,1,,,0,0,,,,,1,,,"169,0","Electronics > Smartphones > Samsung Galaxy A",,,https://webmall-1.informatik.uni-mannheim.de/wp-content/uploads/2025/05/3169.jpg,,,,,,,,,0,,mediamarkt.pl_3467,3169,1,uag-css-1973.css,1
1974,simple,,,"Smartphone SAMSUNG Galaxy A25 5G 6/128GB Yellow SM-A256BZYDEUE",1,0,visible,,"Smartphone SAMSUNG Galaxy A25 5G 6/128GB Yellow SM-A256BZYDEUE.",,,taxable,,1,,,0,0,,,,,1,,,"279,99","Electronics > Smartphones > Samsung Galaxy A",,,https://webmall-1.informatik.uni-mannheim.de/wp-content/uploads/2025/05/3170.jpg,,,,,,,,,0,,mediamarkt.pl_227,3170,1,uag-css-1974.css,16
1975,simple,,,"Smartphone SAMSUNG Galaxy S22 5G 8GB+128GB Black SM-S901BZKDEUE",1,0,visible,,"Smartphone SAMSUNG Galaxy S22 5G 8GB+128GB Black SM-S901BZKDEUE. Order conveniently online now.",,,taxable,,1,,,0,0,,,,,1,,,"269,99","Electronics > Smartphones > Samsung Galaxy S",,,https://webmall-1.informatik.uni-mannheim.de/wp-content/uploads/2025/05/3171.jpg,,,,,,,,,0,,mediamarkt.pl_2247,3171,1,uag-css-1975.css,
